{
  "meta": {
    "title": "LAB SEVEN - Labrador Field Systems",
    "description": "No refueling. No noise. More power than a 7000 watt generator. Professional battery power for production."
  },
  "additionalCSS": ["css/index-components.css"],
  "hero": {
    "title": "LAB SEVEN",
    "tagline": "No refueling. No noise. More power than a 7000 watt generator.",
    "priceText": "Available through Anytime Production Equipment Rentals",
    "availability": "ONE FREE RENTAL DAY WITH PROMO CODE \"241\"",
    "cta": {
      "primary": {
        "text": "Contact Anytime Rentals",
        "href": "mailto:rentals@anytimerentals.com"
      },
      "secondary": {
        "text": "View specs",
        "href": "#specs"
      }
    },
    "links": [
      {
        "text": "See what makes it different",
        "href": "#features"
      },
      {
        "text": "Rental options",
        "href": "#pricing"
      }
    ]
  },
  "overview": {
    "title": "Turn any outlet into 60A distro",
    "subtitle": "Quiet, house-power charging with battery buffering. Plug into a standard 15/20A receptacle, cap the draw, and let the pack cover peaks. Less friction with owners, fewer noise complaints, and a calmer set."
  },
  "specsPreview": {
    "title": "The battery built for production",
    "linkText": "Full Specifications",
    "linkHref": "/specifications",
    "items": [
      {
        "icon": "âš¡",
        "title": "True 60A Power",
        "value": "60A",
        "unit": "OUT",
        "description": "Three 20A Edison on their own circuits, and 1 60A Bates. The only battery with 60A Bates out, no adapters needed."
      },
      {
        "icon": "ðŸ”‹",
        "title": "Fastest Charging",
        "value": "1",
        "unit": "hour",
        "description": "Charge one battery in 1 hour using 60A Bates or 4-5 hours using standard 110v"
      },
      {
        "icon": "ðŸ’ª",
        "title": "7.5kWh Storage",
        "value": "7.5",
        "unit": "kWh",
        "description": "1 or 2 batteries solve any problem for HMU, crafty, production, and more"
      },
      {
        "icon": "ðŸ”Œ",
        "title": "Use Existing Distro",
        "value": "BATES",
        "unit": "",
        "description": "Nobody needs to change their workflows - use the same distro boxes you always have"
      }
    ]
  },
  "featuresPreview": {
    "title": "Why production teams choose LAB SEVEN",
    "linkText": "All Features",
    "linkHref": "/features",
    "items": [
      {
        "title": "Saves money over generators",
        "description": "When you add fuel runs, fire watch, noise complaints, and slow wrap, generators cost more than the day rate suggests."
      },
      {
        "title": "Works everywhere generators can't",
        "description": "Indoor venues, noise-restricted zones, residential areas, and historic locations that prohibit generators."
      },
      {
        "title": "Professional grade reliability",
        "description": "LFP chemistry, BMS protection, real-time monitoring. Built for the demands of professional production."
      }
    ]
  },
  "solutionsPreview": {
    "title": "Solutions for every production type",
    "subtitle": "See how LAB SEVEN solves specific challenges for your role",
    "items": [
      {
        "title": "Experience Agencies",
        "description": "Silent power for brand activations and experiential events",
        "href": "/experience-agencies"
      },
      {
        "title": "Production Managers",
        "description": "Efficient, reliable power for streamlined productions",
        "href": "/production-managers"
      },
      {
        "title": "Gaffers & Lighting",
        "description": "Power your lighting setups anywhere without generator noise",
        "href": "/gaffers"
      },
      {
        "title": "Location Managers",
        "description": "Get venue approval with silent, zero-emission power",
        "href": "/location-managers"
      }
    ]
  }
}
